text;gun-control
Eu sou a favor do porte de arma para qualquer cidadão que faça teste psicológico e curso de tiro, afinal todos merecem se proteger de vagabundos que não trabalham e querem roubar de quem trabalha e paga por seus pertences;for
O cidadão comum deve ter direito a portar uma arma somente quando houverem leis que punam severamente a utilização em situações que não configurem prática esportiva, atividade militar ou de segurança especializada, e legítima defesa, e utilização por pessoas sem treinamento específico.;neutral
A população comum não tem treinamento técnico ou emocional para portar uma arma de fogo. Permitir o acesso a tais armas aumentaria ainda mais o risco de morte de pessoas inocentes.;against
Nem todas as pessoas teriam consciência de usar com sabedoria o direito de portar armas de fogo, por exemplo em caso de defesa pessoal. Acredito que poderia causar um aumento da violência.;against
As pessoas claramente não usarão a arma apenas por questões de segurança. Imagino que com mais armas em mãos erradas, a probabilidade de houver acidentes e crimes são bem maiores;against
Ainda não tenho uma opinião formada sobre o assunto, mas creio que por sermos seres emocionais, acho muito perigoso uma pessoa ter porte de arma sem que seja por trabalho e sem treinamento para controlar as emoções.;against
"O porte de armas não representa nenhuma solução para a violência, o que pode se verificar tanto na teoria quanto na prática (sendo a violência armada nos EUA um enorme problema para aquela própria sociedade). Dar o poder ao cidadão de realizar ""justiça"" não somente não o torna mais seguro como o torna mais perigoso, podendo tomar qualquer conceito de justiça que lhe convenha e utilizá-lo ao seu bel-prazer, isso sem mencionar tiroteios em massa, mais comuns nos EUA (onde o porte é liberado) do que em qualquer outro país no mundo.";against
Gostaria que ninguém tivesse arma é claro. Porém os ladrões no país possuem armas, como cidadão honesto gostaria de possuir uma arma para me defender.;for
"Eu acredito que o porte de armas pode aumentar a criminalidade e atos homicídio, suicídio, morte acidental, tiroteios em massa, etc. Dados evidenciam que a legalização de armas de fogo está diretamente proporcional a maior taxa de homicídios. No Japão, por exemplo, quase extinguiu-se mortes por armas de fogo, enquanto que os Estados Unidos possuem as maiores taxas de ""mass shootings"" e homicídios.";against
"O porte de armas facilitado gera o medo de que pessoas com instabilidades emocionais (patológicas ou não) tenham o poder de incapacitar ou até mesmo matar outra pessoa por motivos menores, como por exemplo em uma briga de trânsito. Acho inválida a justificativa de que haja diminuição da criminalidade se o cidadão possa confrontar o meliante. Ao contrário dos Estados Unidos ou dos países da Europa, cujo conflito armado está fortemente presente em sua história, o Brasil não se encaixa nessa necessidade ""miliciana"" de se ter armas em casa.";neutral
Uma vez que a segurança pública de nosso pais não consegue nos proteger da violência atual, deveríamos ter o direito de nos defender e garantir a proteção dos nossos familiares.;for
O direito de porte de arma ao cidadão comum poderia trazer mais violência para o Brasil o que já é um tema recorrente no cotidiano potencialmente causando mais mortes, mesmo que a arma fosse usado para defesa, é possível que ainda houvesse um aumento na taxa de mortalidade.;against
Restrinjo a minha justificativa para o cenário porte de armas no Brasil. Neste contexto, temos uma grande disparidade cultural, educacional e principalmente uma grande parcela das pessoas com claro exagero no que se diz ao senso para a necessidade de aplicação da violência. Outra grande parcela das pessoas, mesmo com porte legalizado, não encontrará neste meio uma forma de proteção, por questões de habilidade no manuseio, aspectos religiosos, de idade, tampouco conforto com a possibilidade de tirar a vida de outros mesmo em defesa própria. Tais pessoas estarão desprotegidas frente aos demais. É claro que tais afirmações também supõem que as autoridades detentoras do porte de armas teriam o preparo adequado e sabe-se que não é verdade. No entanto são males distintos que deveriam ser tratados com remédios distintos.;against
Creio que não, mas não tenho uma opinião muito bem formada sobre o assunto. Acho que se todo brasileiro tivesse uma arma, ela não seria usada de forma devida, por exemplo uma briga boba de trânsito acabaria em tiro.;against
O desarmamento da população só beneficia os bandidos que continuam tendo acesso a armas. Tornando o porte de armas legal (claro, com certas restrições de idade e pelo menos uma licença de tiro) a população tem o direito de se defender.;neutral
Seguindo o raciocínio de que todo indivíduo tem os três direitos fundamentais supracitados, a este deve ser permitido a defesa de sua propriedade, vida, e se necessário a de seus próximos, para tanto todo indivíduo deve poder portar a todo momento, em sua propriedade os tipos e quantidades de armas que desejar.;for
A segurança da população deve ser uma responsabilidade do governo ou de empresas especializadas no ramo, acredito que liberando o porte de arma, as chances de mais pessoas inocentes morrerem aumenta.;against
"o porte de arma é uma reflexão do precário sistema educacional instaurado no Brasil, conjuntamente com o seu decadente sistema carcerário. o porte de arma está associado ao medo relacionado à ineficiência do controle do governo sobre a impunidade e a ""necessidade"" da justiça pelas próprias mãos.";against
O Brasil é um país complexo e violento, nossos índices por todas as capitais mostram bem isso. A total remoção do direito do porte de armas não é a solução ideal, tal como a total liberação. Portanto, acho que um modelo mais rígido do que de países que possuem tal direito garantido pela constituição, como os Estados Unidos, mas mais flexíveis do que países como o Japão, possa ser uma solução interessante para a realidade brasileira.;neutral
Vivemos numa sociedade bastante violenta e cheia de desequilíbrio emocional e psicológico por todos os lados. Permitir o porte de arma para os cidadãos não resolve nenhum problema, somente adiciona diversas questões.;against
"Um cidadão comum não tem o treinamento necessário para manipular uma arma. Além disso, por mais ""de bem"" que seja uma pessoa, qualquer um é capaz de perder a razão e tirar uma vida. Observando a frequência com que ocorrem tiroteios em massa nos EUA, pode-se perceber que mesmo uma pessoa aparentemente qualificada para possuir uma arma pode fazer algo horrível com ela. Não tem como ter certeza, então é melhor não confiar em ninguém.";against
o cidadão comum não deve ter direito ao porte de arma, pois mesmo que passe por etapas antes de ser liberado provando que tem condições psicológicas de portar a mesma, muitos agirão sem pensar durante o ato em que a arma se faz presente, ou seja, não dá para prever para o que o cidadão portador de arma utilizará a mesma, podendo utiliza-la tanto numa briga de trânsito quanto em caso de legítima defesa.;against
Pessoas em situação de medo ou nervosismo podem utilizar a arma de forma inadequada e querer fazer justiça com as próprias mãos, não sendo apenas um objeto de segurança pessoal, e sim de objeto para tirar a vida das pessoas. Sem contar que facilitaria a ocorrência de novos crimes.;against
O porte de armas de fogo não seria benéfico de maneira alguma, primeiro que as armas de fogo só acarretariam com o aumento da violência e da mortalidade no país. Segundo que as armas de fogo não foram feitas com o intuito de defesa e sim de ataque, então não faz sentido legalizar o uso de utensílios feitos só para praticar uma ação ofensiva para com outro.;against
Acredito que o porte de armas aumentaria o número de casos de violência no trânsito e nas escolas. Na minha opinião, muitas pessoas reagiriam a assaltos, sem qualquer preparo emocional/físico para enfrentar bandidos nas ruas e acabariam causando maiores danos a si mesmas.;against
Entendo que se o cidadão fizer todos os cursos e se mostrar capacitado, ele deve sim ter o direito de se defender. Um malfeitor vai pensar duas vezes em sair assaltando a população sabendo que a mesma pode estar armada.;for
Especificamente, no brasil, acho que deveria ser algo em aberto, no sentido de quem sente necessidade do porte de arma, poderia ter, e quem não faz questão, era somente não ter.;neutral
As armas de fogo não devem ser permitidas para a população geral porque poderia trazer riscos pelos motivos mais banais possíveis, e não resolveria de forma alguma os problemas de violência e crimes. Resumidamente, só traz mais problemas para a sociedade;against
Sim, sou favorável, pelo fato de não vivermos em um pais seguro e livres da violência. Com a aprovação do porte de armas para cidadão, venha inibir um pouco mais a violência que assola nosso País. No qual não temos o direito de ir e vir pelo simples fato de não saber se vamos chegar em nossas casa com segurança.;for
No meu ponto de vista, é improdutivo permitir que o cidadão comum possa ter porte de armas, em relação a diminuição da violência no geral. Mesmo entendendo que há pessoas que tenham interesse de portar armas para a prática do tiro esportivo ou para defesa pessoal, esse benefício é, ao meu ver, inferior ao ganho de se erradicar a possibilidade de homicídios não intencionais gerados pelo uso de armas de fogo de maneira imprudente.;against
Minha resposta não é por convicção ideológica e sim por questões práticas. Entendo que exigiria um nível de fiscalização e controle que o estado brasileiro é simplesmente incapaz de oferecer, pelo menos pelos próximos 20 ou 30 anos (se um dia vier a oferecer). E esse talvez fosse o tempo apenas para chegar ao nível atual dos Estados Unidos, que é considerado por alguns como insuficiente.;against
o porte de armas por parte da população não resultaria necessariamente em uma melhoria na segurança das pessoas que obtivessem o direito de portar armas. Isso fica evidente quando observamos os casos de violência com armas legais nos estados unidos, ou como essas armas muitas vezes acabam por ser mais um caminho para espoliar a população mais pobre e negada de certas esferas de consumo, infligindo-lhes penas de morte sem que haja julgamento legal;against
Violência gera violência e no mundo de hoje o que mais se vê é violência e um povo cada vez menos paciente e gentil com o próximo, colocar uma arma na mão de um despreparado mesmo que faça curso ou algo do tipo, não justifica.;against
Acredito que todos devem ser livres para escolherem o que acharem melhor, no entanto, no momento tal liberdade do indivíduo não deve interferir na liberdade do outro. No caso do porte de armas, a liberação do porte de armas sem um controle rígido pode gerar ainda mais violência e prejuízo à sociedade como um todo. Desse modo, acredito que o porte de armas pode ser liberado, mas com restrições. Não acredito que o porte de armas vai resolver o problema da violência do país, já que a violência é resultado de outros fatores bem mais complexos.;neutral
Apesar do livre arbítrio, essa questão deve ser vista com muita cautela, uma vez que na mão de pessoas erradas, o porte de arma pode, justamente, ferir o direito humano já que algum tipo de tiroteio em massa pode ser extremamente perigoso. Além disso, já foi comprovado que locais onde houve proibição das armas, a ocorrência de assassinatos em massa tenderam a reduzir.;neutral
O porte deve ser regulamentado. Entre a liberação total ou geral e a proibição total ou geral. Certo é que a aquisição do porte deve passar um exame rigoroso.;neutral
Por mais que o bandido esteja armado e que, por legítima defesa, o cidadão comum tenha o direito de se defender, o porte proliferado de arma representa um risco à família brasileira, visto que nem todos portadores teriam habilidade técnica e emocional para lidar com o poder de fogo.;against
Acredito que o porte de armas tenha o lado positivo e também o lado negativo. O lado positivo é o fato de que as pessoas poderiam ter maior proteção ou pelo menos uma maior sensação de proteção. O lado negativo é que o Brasil provavelmente não esteja amadurecido o suficiente para esse tipo de medida.;neutral
não é uma resposta efetiva para a violência, na verdade facilita ainda mais que isso ocorra e respostas a violência de forma irresponsável com esse fácil acesso as armas;against
Todo cidadão tem direito de se defender de qualquer forma, inclusive portando armas Com isso o porte de arma deveria ser legalizado e as armas estariam em mãos corretas.;for
Eu acredito que o maior acesso a armas letais eleva o risco de violência (ativa e reativa) na sociedade. Acredito que o argumento que o porte de arma pelo cidadão de bem ajuda a revidar e prevenir violência sofrida por ele tem pouco fundamento empírico. Acredito que o argumento que armas ilegais continuarão existindo irrelevante, pois a questão de fiscalização e combate ao tráfico de armas distinta da decisão sobre porte de armas.;against
armas foram criadas com um objetivo, machucar os outros. O que observo atualmente é que há uma instabilidade na população no que concerne respeito a opinião do próximo. Há falta de respeito e preconceito para com pessoas de outra opinião política, cor de pele, opção sexual, etc. Essa intolerância, aliada as facilidades que as armas propiciam, podem ocasionar em casos de massacres como os vistos nos EUA;against
O cidadão comum não deve se preocupar com esse tipo de questão no seu dia a dia. De fato, dificilmente nos deparamos em situações onde o uso de uma arma seria necessário. Acredito que uma melhora na segurança pública já seria suficiente.;against
O porte de armas é fundamental para o exercício da legítima defesa, então é inconcebível que seja proibido. Aqui, estamos falando não só da defesa contra criminosos, mas também da própria capacidade da sociedade civil se organizar e se defender contra eventuais tiranias estatais.;for
Não devemos impedir a violência através de violência. Os problemas que temos decorrente de armas não será solucionado permitindo que outras pessoas também tenham porte de armas. Vamos pensar na violência resultante que teremos. Isso sem contar com o fato de que pessoas isentas poderão sofrer com esta liberação, já que estarão mais suscetíveis a acidentes por balas perdidas, por exemplo.;against
O porte de armas deveria ser melhor controlado. Se for para liberar o porte então tem que ter um maior controle, exigir exames psicológicos e estudo da vida da pessoa que quer adquirir o porte.;neutral
Existem lados positivos e negativos sobre o assunto. O lado positivo seria a segurança das pessoas em casa, tendo uma defesa que não seja somente a polícia. O lado negativo seria um aumento extraordinário na violência.;neutral
Eu não vejo problema com o porte de armas ser legalizado, porque quem mata são as pessoas, e não as armas sozinhas (se uma pessoa quer matar outra, ela pode conseguir fazer isso de outras formas que não sejam apenas através de armas de fogo).;neutral
Vivemos em um país em que o porte de arma é ilegal, ao mesmo tempo, que a mesma circula de forma legal. Devido a isso, nosso país enfrenta tantos problemas de violência. No Brasil, as áreas com maior porte de arma são em cidades grandes, especialmente as favelas, reflexo disso são as inúmeras mortes, arrastões etc. Então, provavelmente não seria legal cidadão comum ter posse de arma, pois os que são considerados bandidos hoje um dia foram cidadãos de bem e não possuíam armas em suas mãos.;against
o porte de armas existe no Brasil. só que e muito burocrático. A pessoa tem que ser idônea, passar por teste psicológico, fazer teste de auto defesa.;neutral
O ser humano, em geral, não é maduro o suficiente para ter o porte de armas. A melhor forma de defesa pessoal é investir no desenvolvimento de empatia entre as pessoas.;against
O porte de armas deveria ser feito de maneira controlada e altamente supervisionada. Infelizmente, acredito que aqui no Brasil isso não será feito de maneira controlada.;neutral
Despreparo total das pessoas. Descontrole governamental. O porte de armas não vai diminuir a violência no brasil, ou em qualquer outro lugar do mundo.;neutral
Não acredito que o armamento do cidadão seja a solução para a violência, nem mesmo como forma paliativa. Hoje o Brasil está entre os dez países que mais matam com armas de fogo no mundo e acredito que o porte de arma, na mão de um povo sem educação, só aumentaria estes índices. Além disso, vale ressaltar que, pelo menos no aspecto de porte de armas, não é adequado comparar o Brasil com outros países como a Suíça, que possui uma população altamente armada e com baixos índices de violência, pois obviamente a outros muito fatores como educação e liberdade econômica que interferem na análise.;against
A sociedade não dá mais o mesmo valor a vida por isso, um simples desagrado pode ser visto como motivo para usar o porte de arma como ameaça muito mais do que defesa.;against
Acho imoral o controle de qualquer produto pelo estado. Creio também que restringir armas com o argumento de redução da violência é um pouco tolo. Qualquer objeto pode ser uma arma. Ferimentos de faca são muito mais letais do que ferimentos de disparos de arma de fogo. Enfim, eu acho um tanto cômico que o estado use de armas de fogo para atentar contra o cidadão quando ele possui uma arma de fogo;for
O controle das fronteiras de países grandes é ineficiente em todo o mundo. Além disso, o próprio controle interno da violência brasileiro é precário. Esses dois fatores, aliados à corrupção dos próprios policiais, tornam o controle de armas dos criminosos utópico. Dessa forma, uma maneira do cidadão de bem se defender, já que o Estado atual é incapaz, é o porte de arma. Alemanha e Suécia são países com 30 armas por 100 habitantes e possuem baixios índices de homicídio.;for
Depende de a pessoa ter um discernimento lógico e humanitário necessário para ter a responsabilidade e sofrer consequências de seus atos e escolhas a partir do momento em que possui em mãos um objeto que agirá provavelmente em definitivo na vida de outra pessoa, sabendo avaliar situações e convivendo responsavelmente com suas repercussões. E dependendo do país, tanto a cultura quanto o nível educacional da população quanto o índice de violência deveriam ser avaliados e levados em consideração para tal decisão.;neutral
Não tenho muito segurança em dizer que um cidadão armado poderia evitar um assalto/crime. Acredito que, em muitos casos, uma reação poderia gerar um desastre maior. Acredito que deveríamos tentar resolver a criminalidade aumentando a qualidade da educação e dando mais oportunidades a todos. Não acho que armar as duas partes, criminoso e cidadão, resolva o problema.;against
Existe uma falsa hipótese de que portar uma arma traz segurança para o indivíduo, porém isso na verdade pode ter efeito reverso e contribuir ainda mais para a violência. A arma é algo de efeito imediato que pode acabar com vidas em momentos que a pessoa não está completamente lucida.;against
Amparados pelo direito de defesa da propriedade, o porte de arma legalizado abriria a liberdade para o cidadão escolher se deseja portar arma ou não. Obviamente a obtenção do porte deve ser extremamente controlada;for
Não sou a favor do porte de armas, pois acredito que isso só aumentaria a violência e não acredito que portar uma arma seja medida de proteção pelos seguintes motivos: (a) o criminoso tem o elemento surpresa e portar uma arma aumentaria as chances dele reagir à altura, (b) não existem evidências de que sociedades onde o porte de armas seja legalizado sejam menos violentas, (c) portar uma arma pode ser mais um motivo para a ação de bandidos interessados na arma de quem porta, (d) a presença de armas de fogo no lar pode ser causa de acidentes com crianças e crimes passionais, entre outros.;against
Atualmente, em um país como o nosso, onde o porte de armas por cidadãos comuns é proibido, porém a utilização recorrente e facilidade de aquisição por marginais é instaurada de forma comum, além da falta de segurança encontrada pelo cidadão ao sair nas ruas e não possuir o apoio da polícia, seja ela de qualquer patamar, mostra que os únicos que sofrem desvantagem são aqueles que batalham todos os dias para conseguir sua vida de forma digna.;for
Acredito que ninguém além das forças policiais e de segurança deveriam ter acesso a armas. Porém ainda tenho ressalvas em alguns casos e pouca informação pra ter a opinião completamente formada.;against
Não concordo com o porte armas de fogo aqui no Brasil. Pois na sociedade atual em que vivemos, algumas pessoas, não todas, iriam conseguir usar da forma correta. Como por exemplo, em uma simples discussão, um portador de arma de fogo, pode simplesmente pegar a sua arma e atingir o próximo sem ter a necessidade para tal. Creio que isso seja um risco grande no Brasil, iria apenas aumentar a violência.;against
Qualquer pessoa de boa conduta, que possua treinamento para sua utilização e que não possua problema psicológico deveria poder possuir porte de arma para defender sua casa. A polícia não está conseguindo garantir a segurança.;for
Sou contra o porte pessoal, mas não tenho a mesma convicção quanto a ter arma em casa. Legalizar e disseminar o porte de armas seria facilitar o seu uso, com consequências irreversíveis. O ônus da segurança é do Estado.;against
Por ser a favor das liberdades individuais e entender que não cabe a um Estado, que não me fornece a segurança necessária, dizer o que eu posso ou não utilizar para me defender de ataques de terceiros.;for
"Quando se fala em ""armas"" em geral (e especialmente no Brasil), nada de bom vem à minha cabeça, mas se você considerar todos os problemas que a polícia enfrenta atualmente como despreparo, baixos salários e corrupção, talvez não seja uma ideia tão ruim assim permitir que a população possa resolver por si só parte do problema da segurança pública.";neutral
Relacionando os índices de violência de países com porte e sem porte é simples inferir que mais armas = maior chance de fatalidades. O Brasil tem um dos maiores índices de violência do mundo, o que só pioraria com a liberação do porte.;against
Já vivemos em uma sociedade violenta demais, o porte de armas só vai estimular ainda mais essa violência. Sem o porte de armas as pessoas já estão se matando por motivos pífios, imagine com a liberação do porte de armas.;against
Em teoria, deveríamos deixar o porte de arma a cargo de cada indivíduo. Porém, armas foram feitas para matar, sendo assim, não acho que faz sentido qualquer cidadão tenha a possibilidade de ter armas. O que esse cidadão deseja? Matar alguém? Talvez, ter a sensação de segurança? A sensação de segurança deve ser buscada por meio do Estado dando mais policiamento, garantindo a punição daqueles que cometem crime. Não é tendo uma arma que resolveremos a segurança do mundo.;against
Sou contra, porém, quando as armas de fogo podem ser acessadas pelos bandidos - mesmo que por meios ilegais - é um problema. Estes abordarão os cidadãos de bem sem muitas preocupações, já que o porte de armas não seria legalizado, e consequentemente não haveria formas de o cidadão comum se defender no mesmo nível de armas do assaltante.;against
Acredito que o porte de armas é uma questão de segurança pública, e o porte de armas aumenta o número de situações de violência, em especial a violência doméstica e em escolas;against
Basta uma pesquisa simples pra se constatar a correlação entre leis menos rígidas no controle de armas e as mortes por armas, tanto suicídios, homicídios e acidentes. Em situações ideais a capacitação de um civil para operar um equipamento desses já é questionável, e a situação se agrava ainda mais no Brasil, país que sofre de déficit educacional desde sempre e politicamente em falta. O mais importante é desescalonar quaisquer conflitos, não solucioná-los de maneira tão cabal e violenta.;against
Proteção, porém perigoso.;neutral
Provavelmente não, porque, além de não ser qualquer cidadão que sabe manejar uma arma, ele pode não ter a responsabilidade e mente treinada para julgar e agir nas situações em que usaria uma arma, mesmo sendo para defesa pessoal.;against
Acho que na sociedade o problema de se fazer justiça é mais complexo, e está relacionado a mais fatores educacionais do que simplesmente resolver de forma reativa a uma situação.;against
A sociedade brasileira não está preparada para que seja liberado o porte de armas. Na minha opinião devem ser aplicados testes, assim como para dirigir um carro, e como ainda há muita corrupção com diversos documentos, não seria diferente com o porte de armas. Além disso, é preciso entender que grande parte dos brasileiros ainda possui baixo grau de instrução, o que leva a dificuldades de relacionamento e violência exagerada em uma discussão. Com armas disponíveis a chance de um acidente desnecessário é muito maior.;against
