text;gun-control
As pessoas tem o direito de possuir qualquer bem material, ter arma não implica em ser criminoso. Até porque um pessoa criminosa pode usar qualquer coisa como arma.;for
Não considero prudente armar uma população. A história já provou que população armada causa tragédia. Acredito que o porte de armas deve ser reservada apenas às forças armadas e às polícias.;against
Acredito que o ser humano ainda não tem maturidade suficiente para saber portar uma arma com segurança e isto adiciona uma série de riscos para a sociedade, como por exemplo, em caso de brigas de trânsito, traição do cônjuge, discussão em baladas noturnas e desavenças de qualquer tipo. Num futuro distante onde o ser humano tenha respeito ao próximo, a arma também não será necessária devido ao grau de evolução da sociedade que não mais precisará dela.;against
É uma questão técnica as pessoas não estão Preparadas para usar arma de fogo Elas têm que estar preparada para se defender com ou sem arma de fogo podemos entender isso como uma falsa proteção;against
Acredito que o manuseio de armas deve ser algo que necessite de treinamento. Atualmente, não vejo como um cidadão comum possa utilizar uma arma sem consequências.;against
Acredito que o cidadão deveria ter o direito à possuir uma arma, entretanto, deveria ter uma legislação severa, cursos e testes psicológicos validando assim a possibilidade de obter tão dispositivo.;for
Nossa sociedade não possui um nível de educação e ética suficientes para poder portar uma arma de fogo uma vez que qualquer pessoa que porta uma arma de fogo é um potencial assassino e não viável que o governo consiga dar um mínimo de treinamento para cada um que queira possuir uma arma.;against
Se o porte de armas for legalizada, a milícia não poderá, por exemplo, retirar as armas legalmente das mãos dos criminosos, ou seja, enquanto não realizar crime com a própria arma, não há forma do estado controlar a posse das armas.;against
Um bom exemplo do caos da liberação do porte de armas é os Estados Unidos, onde a todo tempo temos notícias de cidadãos comuns cometendo crimes bárbaros.;against
Acredito que o porte de armas exija treinamento técnico e estabilidade emocional. Cidadãos comuns podem usar as armas para fins que aumentariam a violência em vez de diminui-la, como em brigas de trânsito ou entre vizinhos.;against
O porte de armas não deveria ser aceito no Brasil. Na minha opinião, a população não é preparada para esse uso. Em qualquer situação, seja banal, ou não, se tiver uma oportunidade, podem usa-la de um jeito errado.;against
Apesar de acreditar que as pessoas são livres, o porte de armas por civis representa um grande perigo à vida dos outros cidadãos e ao equilíbrio da sociedade como um todo.;against
Não acho que nosso povo seja responsável para ter porte de arma. Ter uma arma não significa necessariamente que você está mais seguro. Acredito que essa decisão só vai gerar um aumento no número de ferido e mortos por arma de fogo.;neutral
A defesa do porte de armas se dá comumente sob a falaciosa ideia de segurança que ela proporciona. Porém, a segurança não se encontra no objeto, mas sim num sistema que preza pela bem estar social. Assim, o porte de armas acaba por ser um disparador de situações que podem vir a ser mais graves do que precisariam, uma vez que o indivíduo passa a se considerar no poder de julgar quando, onde e o que quiser, podendo causar consequências graves e irreversíveis.;against
O porte de armas deveria, provavelmente, ser liberado aqueles que atendam os requisitos para possuir essa permissão. Outro ponto é a questão da liberdade de indivíduo escolher o que é melhor para si.;for
O porte de armas por um cidadão comum poderia ser legítimo em casos de proteção pessoal ou determinadas atividades bastante específicas. Porém, o que vemos, muitas vezes, é a utilização de armas pelos cidadãos comuns em situações banais, como brigas familiares, discussões de trânsito, brigas entre vizinhos, ou até mesmo para suicídios e demonstração de poder. Os casos em que podem ser gerados danos de diversas naturezas superam os casos em que realmente o porte de armas traz algum tipo de benefício. Portanto, não dar o direito a um cidadão comum do porte de armas, talvez seja a melhor opção para prevenir que haja prejuízos à sociedade.;against
Acredito que a principal razão do porte de armas não estar liberado é o medo da população causar uma guerra civil, já que muitos estão revoltados com tanta corrupção no país. Infelizmente é uma discussão totalmente política, onde as empresas bélicas também usam de chantagem emocional afim somente de ganhar dinheiro sem se preocupar com as consequências. Acredito que pessoas capacitadas devem sim portar armas, e que as leis deveriam ser pesadas para casos que não sejam realmente necessários o uso de uma arma. Outra razão é que não é difícil conseguir uma arma, portanto se uma pessoa deseja fazer algo, não é o fato do porte ser ilegal que irá impedi-la.;for
o cidadão não deve portar armas, pois muitas crianças são vítimas de armas de fogo em casa e o cidadão não estará mais seguro portando e sim será mais um alvo para o criminoso que precisa de mais uma arma;against
"Não é justo em um pais com índices de violência tal alto e uma vasta desigualdade social que apenas bandidos ""possam"" andar armados. O porte de arma, nem que seja em um caso residencial, deve ser um direito do cidadão de bem, para que esse possa se proteger e proteger a sua família.";for
O ideal seria a proibição completa de qualquer tipo de porte de armas, no entanto, na sociedade tão violenta que vivemos atualmente no pais. A proibição de porte de armas as pessoas de bem nos tira o direito de nos proteger dos criminosos que não estão sujeito a esta restrição, legalmente, de porte de armas.;neutral
Todo cidadão deve ter o direito de se defender. Uma população desarmada fica à mercê de seu próprio governo, vários governos na história desarmaram sua população após tomarem o poder, como exemplo temos o nazismo de Hitler e o comunismo de Stalin.;for
O porte de armas é um erro, pelo menos no Brasil... Nossa cultura é totalmente diferente de países onde o porte de armas é liberado. A maioria dos policiais treinados que matam alguém em ofício necessitam de tratamento psicológico e psiquiátrico, um cidadão comum não teria condições de utilizar uma arma de fogo contra outra pessoa.;against
A facilidade de comprar armas pode gerar ainda mais mortes em um País repleto de desigualdade social. As dificuldades do cotidiano na vida de um cidadão comum podem ter consequências trágicas quando uma arma é usada em situações de tensão emocional.;neutral
O porte de arma poderia existir. Mas não tenho certeza como o brasileiro utilizaria este benefício. Acredito que se usada para legítima defesa seria bom, porém acho que em uma simples discussão de trânsito pode tornar uma tragédia.;for
Acredito que nas atuais circunstâncias no país o cidadão comum não tem a mínima maturidade para portar uma arma de fogo. Faço parte de uma família com diversos policiais e incansavelmente toda semana alguma tragédia acontece com policiais devidamente treinados para portar uma arma. Acidentes, brigas de trânsito, discussões familiares, erro na operação no equipamento, bebidas alcoólicas, entre diversos outros motivos me deixam claro que uma pessoa comum, mesmo que submetida a diversos testes não tem nem condições de portar uma arma de fogo;against
As pessoas têm o direito de comercializarem qualquer produto que quiserem, incluindo armas. Impedir que alguém tenha uma arma fere a liberdade de escolha dela e o direito de defesa.;for
Acho que o cidadão comum não deveria ter o direito de ter o porte de armas pois muitos podem usar isso como um tipo de ameaça sem necessidade. E o aumento de mortes seria bem maior.;against
Acredito que cada cidadão tem o direito de poder se proteger sem depender da segurança pública. O problema disso é que atualmente o Brasil não tem estrutura legal nem fiscalização o suficiente para manter o controle disso.;neutral
O porte de armas está garantido na constituição do Brasil e ratificado por meio de referendo, no entanto, através de decretos e leis complementares dificultou-se e muito o seu acesso e disponibilidade por parte de governantes nada democráticos. Em um país sério e comprometido com a liberdade individual das pessoas, nem sequer haveria esta discussão.;for
Nenhum cidadão comum deveria portar armas! Controlar o porte de armas deveria ser uma prioridade no mundo inteiro. Assim, a violência e a guerra entre as pessoas reduziriam muito.;against
O porte de armas é uma questão bastante complicada pois existem vários acidentes que podem resultar em fatalidade. Entretanto, ao mesmo tempo, pode te trazer segurança e reduzir a marginalidade. A polícia é a única autorizada, mas ao mesmo tempo tem muitos marginais que conseguem armas. A população é a que sai prejudicada. Deveria ter alguma regulamentação permitindo, desde que seja controlada por lei.;neutral
O povo Brasileiro não possui maturidade para possui armas, com a situação que o país se encontra hoje o porte de arma só acarretaria em várias tragédias ao redor do país.;against
a sociedade brasileira não está preparada para porte de armas, aliás nenhuma sociedade humana. O ser humano não tem controle ou inteligência emocional, e qualquer assunto que o perturbe pode ser motivo para querer pegar a arma e resolver no tiro em lugar de argumentar.;against
É muito perigoso uma pessoa que não foi treinada ter acesso a armas, em um momento de raiva ou depressão pode acabar cometendo uma tragédia, as pessoas ainda não estão preparadas para lidar com tanto poder.;against
"O porte de armas deveria ser legalizado sim e não as drogas! No momento vivemos em uma sociedade doente, onde existe uma inversão de valores muito grande! O bandido pode ter armas, vivemos sob pena de morte em que o bandido dá a sentença! Isso é muito injusto, não podemos nos defender se alguém invade nossa casa ou carro. Na verdade, tudo isso vem de uma visão socialista que deixa o povo refém e vulnerável ao Estado, eles nos deixam desarmados, nós cidadãos de bem e os marginais continuam armados, qual a lógica disso? Mesmo não tendo porte de armas, no Brasil você fica sabendo através da imprensa, de muitos casos em que o namorado, pai, padrasto etc., matam suas esposas, ex namoradas etc. Então, se na casa dessas garotas tivesse um pai ou mãe armados, com certeza a pessoa que gostaria de fazer uma maldade, ela pensaria duas vezes antes de fazer, porque saberia que tem consequências. No momento, não existe consequência ao crime em nosso país. Nos U.S.A, recentemente um professor meu amigo, especialista em ciências Forenses, esteve na Flórida para dar treinamento, palestras etc. a alguns policiais e pessoas que trabalham nas prisões. O que ele relatou foi o seguinte: Lá existe a política punitiva, qualquer coisa que alguém faça fora da lei, irá pagar por isso. Até mesmo algo ""bobo"" como por exemplo derrubar comida no chão (dentro da cadeia) porque não quer comer aquilo, um preso fez isso e foi obrigado a trabalhar sem parar o dia todo para pagar o dia de serviço do faxineiro que limpou a bagunça dele. Quer dizer, o cara ficou ali o dia todo fazendo a mesma tarefa repetitiva para pensar no que fez e viu que teve consequências, que seria melhor agradecer a comida que tem. No Brasil é o oposto! Ai de uma mãe que bater em seu filho! ela pode perder a guarda da criança, mas pode ficar na Cracolândia com o seu bebê ali no meio das drogas de boa, ninguém vem resgatar a criança ou punir essa mãe por maus tratos. Nosso país é um país hipócrita e incongruente.";for
Não acredito que o porte de armas resolva o problema da violência. Além disso o porte de armas requer treinamento e aptidão. No frigir dos ovos acredito que tendo mais arma na sociedade teremos mais violência.;against
Eu acredito que o cidadão comum deve ser capaz de se defender, e a população como um todo deve ser capaz de se voltar contra um governo que não a satisfaz. Contudo, temo que uma liberação do porte de armas especificamente no Brasil sem uma boa regularização possa ser mais prejudicial do que benéfica. Além disso, há muitos exemplos bem-sucedidos e malsucedidos no que tange a assuntos relacionados a este tópico, e com culturas não necessariamente comparáveis à cultura do nosso país.;neutral
Em uma sociedade onde as pessoas possuem meios para se defender, torna-se um ambiente hostil, onde as pessoas mal intencionadas passará a respeitar mais, por saberem que todos ali possuem recursos para se defenderem.;for
Acredito que a liberação de porte de armas de fogo pode estimular ainda mais a violência no país e que não haveria um controle sobre isso considerando as leis ineficientes do nosso país.;against
Porte de armas estimula a violência. Ninguém deve ter direito ao porte de armas. É comprovado que muitos acidentes acontecem e também a violência urbana se alastrando, corre o risco de se estabelecer a justiça com as próprias mãos.;against
Armas não resolvem a violência, pelo contrário! Há evidências que mais armas na sociedade aumentam suicídios, assassinatos e insegurança no geral. E o principal objetivo de uma arma é matar, portanto nem é um objeto que deveria existir.;against
Acho que pode gerar mais violência e acidentes. Uma arma em casa pode gerar mais problemas que soluções caso uma criança, por exemplo, tenha acesso a essa arma.;neutral
"No Brasil, o número de pessoas que brigam no trânsito e dirigem embriagadas é alarmante, os níveis de violência domésticas são altos e pessoas que adoram fazer ""justiça"" com as próprias mãos é o que não falta. Em um ambiente como esse, a liberação do porte de armas para população comum provavelmente não é uma boa ideia sem uma forte campanha de conscientização e fiscalização dos que tiverem acesso, que são duas coisas em que o Brasil já se mostrou falho em diversas outras ocasiões.";against
Isso é uma decisão muito complexa para a nossa realidade. Países como o EUA, por mais que alguns não considerem, a legalização do porte de armas deu certo. Mas aqui acredito também ser válida, mas precisa ser introduzida com um certo cuidado, para que isso não se banalize e vire porta ainda mais fácil para o bandido conseguir se armar.;neutral
Armas de fogo são mortais, se o acesso a elas for liberado para a população geral provavelmente aumentará o número de incidentes causados por arma por diversas razões, por exemplo, acidentes, furtos da arma para outros fins, uso das armas em momentos que a pessoa não se encontra em plenas faculdades mentais.;neutral
Os Seres Humanos de hoje estão muito agressivos, frios e sem amor no coração, com certeza usarão este porte de armas erradamente. No momento só concordo em liberar o porte de armas, para pessoas que passam por um treinamento funcional e rigorosamente disciplinar.;against
A Indonésia possui um dos menores índices de criminalidade e assassinatos por porte de armas, além de ser um dos países subdesenvolvido. Ainda menor que os EUA em termos de criminalidade, os EUA possuem um dos piores índices se comparado com países Europeus. Alguns dizem que Harvard fez uma pesquisa sobre o porte, e na realidade foi apenas uma notícia de Harvard sobre uma pesquisa de outra Universidade e cheias de furos, como comparar a criminalidade do Reino Unido com dos EUA. Agora pela lógica, você deixaria um homofóbico, machista, racista, bêbado, violento, suicida usar uma arma? Nós EUA já estourou até o número de tiroteios em escolas, imagine o Brasil quando a arma for mais disponibilizada.;against
Não temos segurança suficiente para proteger todo cidadão, então cada um podia ter o direito de se defender, já que um ladrão anda sempre armado um cidadão do bem também poderia andar.;for
Considero um instrumento de proteção legal ao cidadão se comprovada a aptidão psicológica e a efetiva necessidade. O problema do Brasil é que o armamento ilegal vai nas mãos dos bandidos e o nosso Estado não se preocupam com isso.;neutral
Esse problema leva em consideração quatro fatores: países restritivos ao uso de armas, países liberais ao uso de armas, países com alto índice de homicídios/violência, países com baixo nível de homicídios/violência. Ao cruzar essas quatro características, não se observa uma correlação entre liberação do porte de armas e violência. Há exemplos de países nos quais há permissividade com o uso de armas e baixa violência, países com permissividade ao uso de armas e alta violência, países com restrição ao uso de armas e baixa violência e países com restrição ao uso de armas e alta violência. Nesse sentido, a liberação do uso de armas depende de análise do seu impacto na sociedade, levando em consideração as características sociais dessa população.;neutral
Tema polêmico, por isso a escolha pelo alternativa talvez. Liberar o porte de arma significa dar o direito de usá-la nas condições em que o indivíduo julgar necessário. E essa avaliação por ter um viés subjetivo, pode fomentar a violência desnecessariamente. E o pior, tirar vidas erroneamente.;neutral
O porte de armas de fogo provê um poder ao cidadão comum de tirar a vida de outros ao seu bem entender (que pode ser auto defesa ou não) e, apesar de ser compreensível que alguns cidadãos sejam inclinados a escolherem o porte como forma de auto defesa, isso não justifica o poder de ferir o direito à vida dos outros ao seu redor. Ademais, o cruzamento de dados do porte de armas de países desenvolvidos em que o porte é legalizado(como os EUA) versus de outros países demonstra uma tendência clara de maior número de mortes quando há legalização, ou seja, possuir uma arma de fogo, como cidadão comum, não diminui e muito menos resolve a violência.;against
O porte de armas não sendo permitido para todos os cidadãos ocasiona vários casos de violência que seriam evitados com o porte. Digo isso no caso de violência realizada por covardes na grande maioria não ocorreriam por não ter certeza se no estabelecimento ou na residência há ou não alguém armado, na dúvida melhor não cometer o crime. Além de pessoas franzinas e frágeis deixarem de ser um alvo fácil. Os países com porte de arma legalizado não têm um índice tão alto de crimes quanto os países que o têm, o que confirma que não é o porte de arma o indicativo de violência e sim a falta da educação e políticas de inclusão.;for
Todo cidadão deve ter o direito de se defender em situações de risco, ainda mais quando um Estado falido não é suficiente para garantir a segurança dos indivíduos. Bandidos não seguem a legislação e, mesmo sem direito a porte de arma, estarão armados.;for
Nossa sociedade não está preparada para lidar com essa responsabilidade e também não acredito que facilitar o porte terá efeito positivo sobre a criminalidade;against
A arma de fogo traz riscos para a saúde das pessoas no convívio próximo ao portador. Caso algum evento traumatizante ocorra na vida do indivíduo, ele pode acabar gerando situações perigosas para todos à sua volta.;against
Imagine dois negros encima de uma moto olhando para você, que está dentro de um carro e em um semáforo. Eles só olham ou querem me assaltar? Buuummm. Pratico dois homicídios e depois descubro que sequer estavam armados. Melhor armar as polícias do país, as quais são treinadas para defender o cidadão. Melhor equipar e treinar as polícias do que o cidadão que sequer possui sanidade mental para portar uma arma.;neutral
Hoje , as pessoas vivem em constante estado de estresse e nervos. Existe muita briga, muito relacionamento ruim, muita maldade, inveja, droga, assalto, assassinatos, e acho que por conta disto, é um perigo o cidadão comum ter uma arma.;against
Os brasileiros não tem maturidade, muito menos discernimento para portar armas, as chances de tragédias ocorrerem é muito grande, por isso a opção de o brasileiro ter direito, não é um tema propício ao Brasil.;against
Todos tem direito a legítima defesa. Armas não matam pessoas, pessoas matam pessoas. Acredito que um carro é muito mais perigoso do que uma arma de fogo. E que a simples suspeita, deixará a bandidagem mais apreensiva, pois hoje, a certeza de que eles são os únicos armados, é imensa.;for
Acredito que se o cidadão comum portar armas de fogo , as chances de desastres acontecerem são maiores . Apenas pessoas seletas deveriam portar armas .;against
No meio em que vivemos não sei se seria uma boa ideia, tendo em vista que já vi em brigas de trânsito uma pessoa ser baleada por ter dado passagem à um pedestre.;neutral
Não acredito neste formato que delega ao cidadão o direito de defesa. Nossa sociedade é muito individual e com pouca empatia.  Acredito sim em deveres básicos do estado. A segurança pública não pode ser privatizada.;against
Acredito que os cidadãos comuns não tem o treinamento e o psicológico para saberem portar uma arma de fogo. Aumenta muito as chances de crimes passionais acontecerem e de uma forma muito mais grave (uma arma de fogo é pior que uma arma branca).;against
Este assunto e um tanto polêmico, porte de armas, nosso pais ainda não está preparado para que o cidadão possa possuir porte de armas, vejo que para alguém tenha porte de armas, teria que passar por um rigoroso processo para ser apto a ter porte de armas.;against
Acho que armas de fogo só trazem mais violência de maneira geral, mas como vivemos em um país muito perigoso e muito desigual acho que em situações específicas e bem regulamentadas o porte pode ter espaço.;neutral
Todos os indivíduos da sociedade deveria ter o direito de escolha se quer ter arma de fogo em casa ou não, pois atualmente que as possui são as forças armadas do estado (Polícia, Exército, Marinha, Aeronáutica, dentre outros) e os bandidos, pois assim controlam a vida das vítimas naquele momento. Acredito que devemos ter a possibilidade de nos defender de igual para igual, pois prefiro ter e nunca precisar, do que precisar e não ter.;for
Acredito que, ao liberar o porte de armas, estamos sujeitos a muitas consequências difíceis de lidar. Acho que muitas vezes as pessoas utilizariam a arma sem necessidade como em brigas de trânsito ou bar, por exemplo.;against
O porte de armas eu acho uma questão mais delicada, que só deveria ser aceito com restrições muito severas. Coisas bastante ruins já acontecem sem o porte de armas ser legalizado, imagina o que aconteceria se pessoas, mesmo com boas intenções tivessem acesso a armas? Elas poderiam facilmente passar para mãos erradas.;against
Vivemos em uma sociedade cada vez mais intolerante e egoísta. Creio que a proibição do porte de armas para cidadãos comuns diminui o índice de violência gratuita.;against
Os cidadãos não devem portar armas de fogo porque com elas poderão fazer mais do que apenas se defender de um possível ladrão. Podem usá-las para assassinatos e coisas do tipo;against
O Estado brasileiro não provê segurança para a população. Nesse caso cada ser humano deve poder garantir sua segurança e de sua família comprando armas. No estado do Texas dos EUA os cidadãos podem comprar armas de fogo.;for
Não acredito que nossa realidade aqui no país permita um porte de arma seguro. Não temos a cultura de respeitar estranhos, então acho que o porte iria acabar com mais vidas inocentes do que trazer segurança contra o crime.;against
Acho que o porte de armas aumentaria a insegurança da população, ao invés de proporcionar o contrário. Alguns podem dizer, então, que armas brancas poderiam também fazer o mesmo mal que uma arma de fogo. Entretanto, penso que a arma de fogo proporciona ao atirador um distanciamento da vítima e o imediatismo do ato (o que potencializa o uso indevido por desequilíbrios emocionais -> pessoas instáveis). Isso para atos impulsivos. Com relação a atos planejados, a arma dá ao portador maior controle sobre a situação de um ataque, por exemplo (o que facilitaria a criação da ideia de execução deles).;against
"Não se combate violência com violência. Num momento de nervosismo, o que se vê à frente serve de ""arma"" a qualquer um. Portanto, deixar uma arma letal à disposição - ainda que do homem de bem, não é razoável. Deve-se fortalecer a capacidade de diálogo das pessoas, conceitos como a ""justiça restaurativa"", não a punitiva-vingativa.";neutral
