text;gun-control
É complicado falar sobre isso. Que a minha pessoa não seja entendida como um cegamente apoiador de determinados políticos, mas não acho que isso será um progresso para a segurança nacional, nem que será o fim do mundo. É comprovado pela ciência que o cérebro age irracionalmente quando está sob efeito da raiva, por isolamento do córtex pré-frontal (vale à pena acrescentar à bibliografia do trabalho) e nesses momentos a pessoa fica muito apta a cometer um homicídio por impulso. Mesmo assim, primeiro que nem todo mundo terá dinheiro para comprar uma arma e sair todos os dias com ela no bolso. Acredito que mesmo quem comprar não vai sair rodando com ela por aí todos os dias. Em segundo lugar, é só pensar: se alguém é impulsivo e quer matar outra pessoa, por que ela não o faria com uma faca? E o fazem, mas são tão poucos que eu, por exemplo, não me lembro da última notícia sobre isso na televisão e muito menos vi alguém o fazer. Mas sei que esse assunto, por ser um assunto sociológico, envolve INÚMERAS variáveis as quais, nem sempre, imaginamos que estão envolvidas e por isso fica difícil ter uma opinião sólida e confiável a respeito. Por isso votei que talvez não, pois apenas acho que isso não mudará nada na nossa vida, mas preferi não afirmar nada categoricamente.;neutral
Só aumentariam os casos de violência e mortes, acidentais ou não. Talvez algumas pessoas consigam se defender de um assalto ou coisa do tipo, mas em contrapartida temos aquelas pessoas que, numa briga de trânsito, se armadas, não pensariam duas vezes. Pessoas que não sabem lidar com algum tipo de frustração são perigosíssimas com armas;against
O porte de armas não seria viável pois possivelmente não haveria diminuição da violência, talvez até aumentasse o número de casos de acidentes por porte de arma. Pessoas agem por instinto num momento de adrenalina e acabam agindo de forma inconsequente.;against
O Estado não fornece segurança ao cidadão e normalmente alteramos a nossa vida por medo. Não saímos a noite e temos medo de caminhar sozinhos. Talvez com a posse de arma possa trazer a segurança que o Estado não fornece;neutral
Um cidadão comum e despreparado (fisicamente e/ou mentalmente) de modo algum deve ter em suas mãos uma arma de fogo. No brasil, o índice de homicídios das mais diversas categorias é altíssimo. Não vai ser colocando uma arma na mão de cada cidadão que esse índice irá diminuir. O correto seria fortalecer ainda mais a segurança pública, pois é para isso que ela serve, para proteger a população.;against
Acredito que o porte de armas ainda é uma ameaça para todos, o cidadão comum ainda não tem condições de portar arma de fogo, seria necessário uma educação para que isto ocorra.;against
Portar arma de fogo é um perigo em potencial. Deveria haver uma política mundial par se reduzir as armas que existem nas mãos de policiais e forças armadas.;against
Acho que armar a população é um caminho perigoso e que pode contribuir para o aumento da violência. Muitas nações de primeiro mundo com taxas baixas de violência, homicídios e população carcerária não adotam políticas de liberação das armas, logo, esse é um indício de que a liberação provavelmente não é um bom caminho. Porém, em algumas situações como no caso de moradores da zona rural, o porte poderia ser uma opção (infelizmente).;against
O porte de armas não deveria ser legalizado para um cidadão comum, pois se trata de algo capaz de tirar a vida de alguém. Logo, não são todas as pessoas que possuem o psicológico para ter em suas mão uma arma.;neutral
Países com população armada não são os mais seguros, armas em casa aumentam os riscos à própria família, em especial às mulheres, em casos de assalto, a arma poderá piorar a situação, a maioria da população é contra o armamento, o tráfico de armas ilegais aumentará;against
O cidadão comum, que vive nos grandes centros urbanos não tem necessidade. Mas o cidadão rural poderia melhor proteger sua propriedade se tivesse a autorização.;neutral
Sou contra qualquer tipo de arma. Não matar. Ninguém deveria ter esse sentimento dentro de si e muito menos possuir uma arma. Educação e amor! O homem pode matar com as próprias mãos, mas tendo arma facilita.;against
Mais violência? Não obrigado. O porte de armas seria decente caso o cidadão mediano não fosse tão ignorante. Veja o caso dos Estados Unidos. Há tiroteio quase todo mês.;against
pessoas que não tenham processo crime, que passem por testes psicológicos, e técnicos, devem ter uma arma para defesa, afinal hoje somente bandidos tem armas;for
Eu não sei em quem confiar a minha proteção, ainda mais na situação em que nosso país e nossa corporação policial se encontram. Mas devido ao cenário brasileiro, a legalização má administrada poderia resultar em mal uso do porte, o que me deixa indeciso sobre dar uma resposta final para esse questionamento.;neutral
Acredito que vivemos em uma sociedade muito violenta, liberar o porte de arma embora muitos falem que é dar opção para o sujeito de bem, é assinar a ineficiência da nossa segurança pública. Acredito que violência gera mais violência. Essa é minha opinião hoje, não sei amanhã.;against
Acredito que provavelmente no Brasil o cidadão comum não deveria ter direito ao porte de arma. O porte de arma dá poder para as pessoas atentarem em relação ao bem maior: a vida. Tendo em vista que as leis no Brasil não funcionam corretamente e a maior parte dos casos de violência não são resolvidos, certamente as pessoas se sentiriam empoderadas a fazer justiça com as próprias mãos, o que tornaria a polícia mais ineficiente do que é hoje. No entanto, há de se refletir que o país já está em guerra, não existe nenhuma unidade que tenha controle da situação atual e o cidadão comum está lançado à própria sorte. Assim, alguns casos que tomam proporções maiores e geram comoção na mídia e na população parecem colocar em dúvida se uma ação imediata não seria permitir que as pessoas ao menos possam defender a si mesmas.;against
Se hoje fosse permitido o porte de armas a sociedade provavelmente viraria um caos, pois qualquer coisa seria motivo para briga e consequentemente o número de mortes seria elevado.;against
Talvez sim, pois, nem todos os cidadãos têm consciência do perigo e ao mesmo tempo do bem que o porte de armas pode causar. Se a população fosse bem treinada, e após exames psicológicos fosse avaliado saúde mental para o uso de tal, este seria um fator que diminuiria a criminalidade, pois, antes de cometer algum crime o cidadão pensaria que a vítima poderia estar armada.;neutral
Segurança deveria caber ao Estado... Se isso fosse eficiente as pessoas se sentiriam seguras e protegidas.;against
Não acredito que um cidadão com pouco ou nenhum treinamento carregando uma arma traga um benefício para a segurança geral que compense o risco que ele causa. Como é inviável treinar toda a população para saber como/quando usar uma arma de fogo e como armazena-la, não vale a pena o risco.;against
O porte de armas é um assunto delicado e perigoso. Creio que o porte liberado para o cidadão comum possa vir a causar problemas, por mais que as vezes armas possam ser mecanismos de autodefesa. Se acontecesse teria que ser algo feito com extremo cuidado;neutral
Este é um tema que ainda deve ser amplamente debatido, embora em alguns países a legalização do porte de arma funcione bem, é necessário conduzir estudos e pesquisas com os cidadãos brasileiros para que se possa entender quais seriam as consequências do porte ao cidadão comum, isto é, entender se de fato a medida contribuiria para a diminuição ou o aumento da violência.;neutral
Se brasileiro já consegue estragar o país só votando errado, não quero nem imaginar o que aconteceria com uma arma de fogo nas mãos e tanto ódio e intolerância por quem não concorda com as suas opiniões.;against
Todo o cidadão tem o direito de se defender de criminosos, porém apesar de concordar com o porte de armas, esta deve ser feita de maneira controlada, por meio de exames e testes, afim de comprovar a capacidade do indivíduo em obter o porte de armas.;for
Embora estatisticamente isso seja benéfico em outros países, creio que o Brasil possui algumas particularidades culturais que podem determinar o sucesso de uma operação de liberação do porte de arma. Tendo isso em vista, creio que seria necessária mais do que uma deliberação sobre o porte, mas sim comunicações e treinamentos para o cidadão comum - a fim de prevenir acidentes e/ou aumento de violência urbana.;against
A posse de armas de fogo poderia ajudar a diminuir a taxa de invasões domiciliares, uma vez que, com o invasor ciente de que o morador possui meios para se defender, o bandido pode ficar receoso. Mesmo isto podendo ser bem raro de ocorrer, é um dos fatores que ajudariam a diminuir a taxa de invasões. E, caso ainda ocorra a invasão, o proprietário poderia proteger a si e aos outros residentes. Mas para que os moradores tenham as condições de operar as armas de maneira correta, eles devem se submeter a treinamento. Portanto, sou a favor do porte de armas, mas desde que seja feito de maneira correta.;for
O porte de armas deve ser realizado apenas para pessoas com qualificação e preparo para isso, a fim de evitar possíveis acidentes. Além disso , o preparo psicológico é fundamental.;against
"Se todos tivessem permissão para ter uma arma, o número de mortes aumentaria significantemente. Apesar do argumento de ""auto-defesa"", é muito provável que tais armas sejam utilizadas para intimidação durante brigas de trânsito, por exemplo.";against
Nem sempre o cidadão consegue contar com o auxílio da polícia rapidamente. este último algumas vezes se encontra muito distante do local onde necessitam de ajuda, como é o caso de fazendeiros. Por se tratar de uma fazenda, sua área tende a ser muito grande de forma que se torna inviável garantir a proteção de sua propriedade 100%. Tornam-se assim, dependentes da agilidade e eficácia da polícia que muitas vezes não conseguem ajudá-los a tempo.;neutral
Acredito que as pessoas são livres para qualquer tipo de escolha. A respeito do porte de arma, não veria problema se houvesse regulamentação, avaliação médica treinamento para o uso de armamentos.;for
Isso pode ser perigoso, em caso de algum tipo de discussão ou briga, alguma pessoa com um temperamento um pouco mais agressivo pode fazer algo de ruim, o porte de armas é 50%-50%.;neutral
Apesar de o Brasil ser um pais muito violento e perigoso, acho que a legalização do porte de armas não é a melhor solução para esse problema, uma vez que só geraria mais problemas e violência, já que a maioria dos cidadãos não é mentalmente preparado para ter uma arma de fogo.;against
O direito à propriedade é inerente ao ser humano, e não é eticamente defensável tirar esse direito. Argumentos utilitaristas e históricos podem ser feitos de ambos os lados, mas os princípios éticos permanecem superiores.;for
Eu creio que não há fundamentos para se pensar em aprovar ou não o porte de armas, pois é evidente que os crimes de violência e mortes de grandes e pequenas gravidade iram aumentar e as prisões e os tribunais não terão tamanha capacidade para acolher tantos casos. É evidente nos país onde o porte de arma é legal tantas fatalidades e crianças sendo julgadas por cometer atos culposos. Os brasileiros não estão civilizados em sua totalidade para receber tamanha responsabilidade.;against
Sendo liberado em outros países, pode-se notar a insensatez de tal ato pelos exemplos históricos envolvendo assassinatos ocorridos em escolas além de mortes por acidentes. Se no Brasil já há assassinatos envolvendo porte de armas ilegal, não existe vantagem em legalizar seu uso e facilitar a compra e venda de tais objetos em um país de extrema violência;against
Ninguém tem o direito de tirar a vida do outro, acredito que violência gera violência. É pela falta de amor, incompreensão, egoísmo que surgem as mazelas e a forma de diminuí-las não será através de armas.;against
Desde a época das cavernas até o recente tempo do velho oeste, o ser humano tem portado armas para se defender. Porém, com a evolução dos meios de prevenção e dissuasão, além da evolução das armas, é possível ao Estado atuar de modo mais contundente de modo a prevenir ameaças, bem como agir mais pronta e eficientemente diante de situações de uso da força. Assim, exceto o contexto de uma nação em guerra, o mais recomendado é que os cidadãos comuns não precisem fazer uso da força de armas de fogo, pois estas são extremamente destrutivas à sociedade, além de haver necessidade de uma grande capacidade de indivíduos e organizações para seu uso, fato este que não é trivial para ser alcançado.   ;against
O porte de armas não deve ser liberado para a população. A compra e porte indiscriminado pode levar ao aumento da violência e mortes causadas propositalmente ou acidentalmente por armas. A cultura brasileira sempre foi baseada na lei de Talião, na justiça com as próprias mãos e nada garante que o porte diminuirá a violência.;against
O porte de arma prejudicaria a segurança e qualidade de vida das pessoas. Imagino que o número de ameaças com a arma de fogo seria prejudicial e traumática para as pessoas. Acredito também que o número de reações em assalto aumentaria bastante e, consequentemente, o número de mortes aumentaria. Acho que funcionaria se existisse uma forma de educação e orientação no manejo da arma que realmente seja eficaz, mas dificilmente será.;against
Fui atirador dos doze aos vinte um anos, nunca fui violento. Nunca utilizei armas contra alguma pessoa. Analisando países onde o cidadão comum tem o direito ao porte de arma, observo que o Brasil não tem índices menores de violência envolvendo armas de fogo.;for
Brigas e discussões sempre irão ocorrer, seja familiar, no trânsito e etc. Nosso povo latino americano possui um emocional muito fraco e orgulhoso, com isso, qualquer desaforo é motivo para confronto. Fornecer armas de fogo para o cidadão comum só aumentaria a quantidade de tragédias. E não, não iria proteger a população contra bandidos armados. Reagir a um assalto é arriscado demais. Enfim, sem um treinamento adequado, qualquer um utilizando uma arma pode facilmente resultar em algo terrível.;against
As armas devem ser de uso exclusivo das autoridades, na atualidade as pessoas estão cada vez mais intolerantes, o porte de armas para todos pode acarretar em tragédias de larga escala.;against
A liberação de armas no Brasil traria mais violência, não creio que a sociedade esteja preparada, ou ainda que teria uma qualificação adequada no caso da liberação.;against
Uma arma é um objeto fabricado pura e unicamente para uso violento. Um objeto desse tipo não deve ter espaço numa sociedade civilizada. Ele fere o direito à vida de todas as outras pessoas ao redor e a segurança deve ser resolvida de forma não violenta.;against
Por mais que eu defenda o porte de armas e outros países nos quais é autorizado, eu não acredito que o Brasil teria capacidade de manter o controle disso e manter a paz nas ruas, a punição seria bem menos rígida e isso incentivaria o uso das tais armas para cometer crimes.;against
O porte de armas pelos cidadãos de forma livre os amadurece quanto à violência do cotidiano, deixando um ar de segurança privada ... porem há a baixa dos preços de armas contrabandeadas contribuindo para a retenção do tráfico !;for
Num país em que os bandidos estão melhor armados que a Polícia, não acredito que estejamos preparados para o porte de armas...Acredito que ao possuir uma arma, o país ficará mais caótico do que já está....;against
O porte de armas de fogo assume violência. A linha entre a autodefesa e a agressão é muito tênue: a noção sobre a sensação de prejuízo e o direito de agredir outras pessoas se torna muito subjetiva.;against
É complicado, pois atrás do porte de arma precisa ter um controle bem apurado. No caso, exames psicológicos, histórico de precedentes e controle da venda também.;neutral
O porte de armas de fogo contribui com a falsa ideia de que a segurança pública está na mão do cidadão comum, tirando-a da pauta de discussão pública. O porte de armas não melhora a defesa da pessoa, ao contrário alimenta o medo que gera insegurança.;against
Uma pessoa com porte de arma, não representa necessariamente segurança para ela e pra sua família, dependendo da pessoa , diversas Situações poderão levar a uma tragédia, como uma falta de orientação de como usar, problemas na escola se tratando de uma criança, a suicídios, caso alguém tenha algum problema psíquico , entre tantos outros .;neutral
O porte de armas pode aumentar a probabilidade de acontecer crimes e casos de violência de uma forma não esperada para uma sociedade que não está preparada para controlar a liberação da maneira correta e que já sofre de inúmeros incidentes de violência sem armas de fogo.;against
O porte de armas é, sem dúvidas, desnecessário para a sociedade. Um ambiente em que todos estão constantemente sob pressão não abre espaço para a confiança e segurança, características que deveriam ser, na teoria, preservadas com o porte de armas, mas, na prática, não ocorre, como visto nos anos anteriores no EUA, em que a legalização de armas trouxe apenas mais problemas sociais, alteração psicológica do portador, acidentes, etc., do que soluções para eles.;against
Porte de Arma de fogo não é a solução para nada, é invenção de guerra, não tem como ser algo bom, principalmente em uma sociedade mal educada e intolerante.;against
A faculdade mental das pessoas deveria ser julgada de forma completa. Por exemplo, no Texas o porte de arma é liberado e você pode andar na rua com a arma na cintura. Porém, quando eu estava lá um mendigo assassinou um policial. Então, esta questão é extremamente complexa. Entretanto, acho que todo cidadão deveria ter o direito de se defender na sua própria casa, como por exemplo uma invasão de domicílio.;neutral
O porte de armas é uma situação que na minha opinião pode gerar violência, pois, qual a necessidade de uma arma de fogo caso você não precisa usar? Eu considero esse tipo de armas desnecessários, porém, acredito que armas brancas como espadas, lanças e alabardas não consistem em um problema caso a pessoa seja um praticante de bushido ou alguma outra arte marcial, pois a pessoa está treinando o corpo e a mente.;against
A arma é apenas um instrumento, e por ser potencialmente letal deveria ser acompanhado de uma permissão adequada para seu uso. Mas infelizmente em um pais com tamanho índice de corrupção tal como o Brasil, licenças seriam compradas de maneira ilegal tal como são as cartas de motoristas. Permitindo assim amplo acesso de pessoas não qualificadas a um instrumento de segurança, assim o transformando em um problema em potencial.;against
O porte de arma só me traria mais insegurança. Ao andar na rua você estaria num medo constante por não saber quem está armado ou não. Por outro lado, na atual crise de segurança pública que nosso país vive, negar a chance de alguém se defender em uma situação de violência não me parece correto.;neutral
Em muitos países, diversas pessoas moram em áreas rurais nas quais não existem delegacias ou batalhões da polícia. Para que a vida delas seja preservada e elas tenham direito à segurança, penso que é importante liberar o porte de armas. Além disso, no Brasil em particular, é recorrente os casos em que a polícia entra em greve, faltam policiais, equipamentos e etc. Por isso, é importante que com muita cautela e restrições, o cidadão comum, devidamente treinado, sem histórico de crimes e com suas faculdades mentais intactas possa ter acesso à armas.;for
O ser humano deve ter o direito do porte de armas para a legítima defesa e deve ser punido caso tenha feito o uso contra outro ser humano. Claro isso significa também o que o a justiça deve funcionar corretamente julgando os casos corretamente.;for
O porte de armas é um incentivo de vingança pessoal e não de justiça ou defesa pessoal. Ademais, quanto mais armas maiores são os risco de ocorrer acidentes. Todos já ouviram relatos de acidentes com armas de fogo ou rompantes que culminaram na perda de uma vida. Não há como armas contribuírem positivamente para uma sociedade.;against
Vivemos um país violento e precisamos nos  defender dos agressores de igual para igual. Não quero que virem um campo de batalha dentro da sociedade, porém precisamos nos defender e ter melhor armamento que os agressores para isso impor a paz.;for
Na minha opinião, penso que o porte de armas não deveria ser legalizado, pois estatísticas mostram que, mesmo sem a sua legalização, o brasileiro morre por situações desnecessárias com uma relativa frequência. Então, acredito que o porte de armas legalizado aumentaria a quantidade de casos de mortes desnecessárias.;against
Cada pessoa tem sua personalidade, difíceis ou não de lidar, o ser humano é muito diferente entre si, qual é o ponto em que a barreira do respeito se torna desrespeito, do crime, da agressão a vida, ao outro, à família.;for
considero arma para cidadãos comuns absolutamente perigoso porque, apesar da violência que há nos tempos atuais se o cidadão comum estiver com uma arma sem saber atirar morrerá o que irá gerar mais violência em série.;against
Acho que a proibição e restrição indiscriminada estimula o desenvolvimento de mercados paralelos e consequentemente o crime. Essa situação é análoga a situação do comércio ilegal de entorpecentes.;neutral
portar armas estimula a violência. mesmo que se diga que não usará, tendo arma, num momento de ira a pessoa é capaz de cometer um desatino. portanto, quanto menos possibilidade de ter arma melhor;against
Minha opinião não é completamente formada, mas tendo a pensar que o porte de armas não é fortemente correlacionado com a violência ou a falta dela. Existem países com baixa taxa per capita de armas que possuem elevados níveis de homicídios por arma de fogo(Brasil, Austrália), países com baixa taxa de armas e níveis baixos de homicídios(China), países com alta taxa de armas e altos níveis de homicídios(Venezuela) e países com alta taxa de armas e baixos níveis de homicídios(Canadá). Para o caso do Brasil, acredito que as únicas mudanças na legislação deveriam ser a exclusão do critério de necessidade(subjetivo), maior rigor nos testes psicológicos e melhor treinamento de tiro e manipulação das armas, bem como a aplicação de um curso breve de legislação de armas de fogo(possíveis crimes, como se configura legítima defesa, como e onde guardar a arma, locais onde você pode levar a arma, etc.);neutral
É arriscado que cidadãos portem armas, pois situações de estresse podem levar a óbito ou até mesmo levar ao problema que os Estados Unidos estão vivendo em suas escolas.;against
Reconheço o porte de armas como um direito que deveria ser garantido à população. Contudo, há outros serviços que o estado deveria garantir, mas não garante ou garante de forma insatisfatória. A segurança pública deveria melhorar, acesso à educação e à saúde de qualidade, o sistema prisional e o judiciário deveriam melhorar. O problema com o tema é que, com frequência, o porte de armas é visto como uma solução rápida para a deficiência dos serviços mencionados. Para que tal direito possa ser garantido, campanhas de conscientização, normas e treinamentos deveriam ser ministrados para que as armas não sejam usadas indevidamente.;neutral
Todo cidadão tem direito a se defender, devendo receber treinamento adequado para isso. Porque o bandido pode ter armas, já que fica impossível à polícia controlar, e o cidadão de bem não?;for
Com tanta insegurança, à vezes pensar em portar uma arma pode trazer um pouco mais de tranquilidade, mas é algo paliativo e não o certo a se fazer. As armas podem servir como proteção para o cidadão comum.;neutral
O cidadão comum não tem preparo técnico e muito menos psicológico para portar uma arma de fogo. Acredito que o número de pessoas baleadas subiria muito e o número de assaltos ou outros crimes não diminuiria tanto assim.;against
O porte de armas em si, não parece um problema para mim. Entretanto, sabemos que nem todas as pessoas estão aptas a ter esse direito, uma vez que pessoas parecem tender a se tornarem mais 'valentes' quando estão com uma arma.;neutral
Existem diversas experiências ao redor do mundo que demonstra que o aumento da quantidade de armas em circulação piora os índices de segurança pública, não há motivos para continuar tentando aplicar tal regra.;against
Além de vários estudos indicando que a violência só aumenta se a população é armada, o Brasil não é sério o suficiente pra esse tipo de situação. Se nem para tirar licença para dirigir os exames são feitos direito, imagina para uma arma de fogo.;against
